{
  "schemaVersion": "1",
  "status": "accepted",
  "criteriaId": "rc-performance-resource-linux-x64-benchmarks-v1",
  "criteriaFixedAt": "2026-09-23",
  "environmentId": "linux-x64-node22-chromium",
  "sourceCommit": "4227160c4dac402d7add53d3f8fe990f693912c1",
  "summaryPath": "evidence/603/summary.json",
  "checks": [
    {
      "key": "browser-wasm:performance:scale-logs-medium-fixed4096:initialization-p95-ms",
      "observed": 17.89999999999418,
      "operator": "<=",
      "threshold": 35,
      "passed": true
    },
    {
      "key": "browser-wasm:performance:scale-logs-medium-fixed4096:processing-p95-ms",
      "observed": 18.800000000017462,
      "operator": "<=",
      "threshold": 250,
      "passed": true
    },
    {
      "key": "browser-wasm:performance:scale-logs-medium-fixed4096:throughput-minimum-bytes-per-second",
      "observed": 13944361.702114707,
      "operator": ">=",
      "threshold": 1100000,
      "passed": true
    },
    {
      "key": "browser-wasm:performance:scale-logs-medium-fixed4096:memory-browserJsHeap-maximum-bytes",
      "observed": 39600000,
      "operator": "<=",
      "threshold": 99614720,
      "passed": true
    },
    {
      "key": "browser-wasm:performance:scale-logs-small-whole:initialization-p95-ms",
      "observed": 17.10000000000582,
      "operator": "<=",
      "threshold": 30,
      "passed": true
    },
    {
      "key": "browser-wasm:performance:scale-logs-small-whole:processing-p95-ms",
      "observed": 8.5,
      "operator": "<=",
      "threshold": 75,
      "passed": true
    },
    {
      "key": "browser-wasm:performance:scale-logs-small-whole:throughput-minimum-bytes-per-second",
      "observed": 7712235.294117646,
      "operator": ">=",
      "threshold": 920000,
      "passed": true
    },
    {
      "key": "browser-wasm:performance:scale-logs-small-whole:memory-browserJsHeap-maximum-bytes",
      "observed": 10000000,
      "operator": "<=",
      "threshold": 25165824,
      "passed": true
    },
    {
      "key": "cli:performance:scale-logs-medium-fixed4096:initialization-p95-ms",
      "observed": 2.4194109999999966,
      "operator": "<=",
      "threshold": 6,
      "passed": true
    },
    {
      "key": "cli:performance:scale-logs-medium-fixed4096:processing-p95-ms",
      "observed": 11.586400999999995,
      "operator": "<=",
      "threshold": 200,
      "passed": true
    },
    {
      "key": "cli:performance:scale-logs-medium-fixed4096:throughput-minimum-bytes-per-second",
      "observed": 22626007.851791088,
      "operator": ">=",
      "threshold": 1500000,
      "passed": true
    },
    {
      "key": "cli:performance:scale-logs-medium-fixed4096:memory-processRss-maximum-bytes",
      "observed": 3399680,
      "operator": "<=",
      "threshold": 8388608,
      "passed": true
    },
    {
      "key": "cli:performance:scale-logs-small-whole:initialization-p95-ms",
      "observed": 2.6985930000000025,
      "operator": "<=",
      "threshold": 6,
      "passed": true
    },
    {
      "key": "cli:performance:scale-logs-small-whole:processing-p95-ms",
      "observed": 5.070641999999992,
      "operator": "<=",
      "threshold": 50,
      "passed": true
    },
    {
      "key": "cli:performance:scale-logs-small-whole:throughput-minimum-bytes-per-second",
      "observed": 12928145.982303642,
      "operator": ">=",
      "threshold": 1400000,
      "passed": true
    },
    {
      "key": "cli:performance:scale-logs-small-whole:memory-processRss-maximum-bytes",
      "observed": 3420160,
      "operator": "<=",
      "threshold": 8388608,
      "passed": true
    },
    {
      "key": "node:performance:scale-logs-medium-fixed4096:initialization-p95-ms",
      "observed": 6.502980000000008,
      "operator": "<=",
      "threshold": 15,
      "passed": true
    },
    {
      "key": "node:performance:scale-logs-medium-fixed4096:processing-p95-ms",
      "observed": 14.028017000000006,
      "operator": "<=",
      "threshold": 200,
      "passed": true
    },
    {
      "key": "node:performance:scale-logs-medium-fixed4096:throughput-minimum-bytes-per-second",
      "observed": 18687887.247356478,
      "operator": ">=",
      "threshold": 1400000,
      "passed": true
    },
    {
      "key": "node:performance:scale-logs-medium-fixed4096:memory-nodeHeap-maximum-bytes",
      "observed": 21702216,
      "operator": "<=",
      "threshold": 54525952,
      "passed": true
    },
    {
      "key": "node:performance:scale-logs-medium-fixed4096:memory-nodeRss-maximum-bytes",
      "observed": 95756288,
      "operator": "<=",
      "threshold": 243269632,
      "passed": true
    },
    {
      "key": "node:performance:scale-logs-medium-fixed4096:memory-nodeExternal-maximum-bytes",
      "observed": 2353643,
      "operator": "<=",
      "threshold": 6291456,
      "passed": true
    },
    {
      "key": "node:performance:scale-logs-small-whole:initialization-p95-ms",
      "observed": 6.207783000000006,
      "operator": "<=",
      "threshold": 15,
      "passed": true
    },
    {
      "key": "node:performance:scale-logs-small-whole:processing-p95-ms",
      "observed": 1.5061589999999967,
      "operator": "<=",
      "threshold": 35,
      "passed": true
    },
    {
      "key": "node:performance:scale-logs-small-whole:throughput-minimum-bytes-per-second",
      "observed": 43523957.29800117,
      "operator": ">=",
      "threshold": 2000000,
      "passed": true
    },
    {
      "key": "node:performance:scale-logs-small-whole:memory-nodeHeap-maximum-bytes",
      "observed": 7483168,
      "operator": "<=",
      "threshold": 18874368,
      "passed": true
    },
    {
      "key": "node:performance:scale-logs-small-whole:memory-nodeRss-maximum-bytes",
      "observed": 67899392,
      "operator": "<=",
      "threshold": 170917888,
      "passed": true
    },
    {
      "key": "node:performance:scale-logs-small-whole:memory-nodeExternal-maximum-bytes",
      "observed": 2322073,
      "operator": "<=",
      "threshold": 6291456,
      "passed": true
    },
    {
      "key": "python:performance:scale-logs-medium-fixed4096:initialization-p95-ms",
      "observed": 1.170782,
      "operator": "<=",
      "threshold": 3,
      "passed": true
    },
    {
      "key": "python:performance:scale-logs-medium-fixed4096:processing-p95-ms",
      "observed": 9.337019,
      "operator": "<=",
      "threshold": 200,
      "passed": true
    },
    {
      "key": "python:performance:scale-logs-medium-fixed4096:throughput-minimum-bytes-per-second",
      "observed": 28076841.227376744,
      "operator": ">=",
      "threshold": 1600000,
      "passed": true
    },
    {
      "key": "python:performance:scale-logs-medium-fixed4096:memory-pythonHeap-maximum-bytes",
      "observed": 537740,
      "operator": "<=",
      "threshold": 2097152,
      "passed": true
    },
    {
      "key": "python:performance:scale-logs-medium-fixed4096:memory-processRss-maximum-bytes",
      "observed": 21856256,
      "operator": "<=",
      "threshold": 53477376,
      "passed": true
    },
    {
      "key": "python:performance:scale-logs-small-whole:initialization-p95-ms",
      "observed": 1.127025,
      "operator": "<=",
      "threshold": 2,
      "passed": true
    },
    {
      "key": "python:performance:scale-logs-small-whole:processing-p95-ms",
      "observed": 1.633662,
      "operator": "<=",
      "threshold": 35,
      "passed": true
    },
    {
      "key": "python:performance:scale-logs-small-whole:throughput-minimum-bytes-per-second",
      "observed": 40127027.50018058,
      "operator": ">=",
      "threshold": 2000000,
      "passed": true
    },
    {
      "key": "python:performance:scale-logs-small-whole:memory-pythonHeap-maximum-bytes",
      "observed": 75205,
      "operator": "<=",
      "threshold": 1048576,
      "passed": true
    },
    {
      "key": "python:performance:scale-logs-small-whole:memory-processRss-maximum-bytes",
      "observed": 20955136,
      "operator": "<=",
      "threshold": 54525952,
      "passed": true
    },
    {
      "key": "rust-core:performance:scale-logs-medium-fixed4096:initialization-p95-ms",
      "observed": 0.07312,
      "operator": "<=",
      "threshold": 1,
      "passed": true
    },
    {
      "key": "rust-core:performance:scale-logs-medium-fixed4096:processing-p95-ms",
      "observed": 9.267012,
      "operator": "<=",
      "threshold": 200,
      "passed": true
    },
    {
      "key": "rust-core:performance:scale-logs-medium-fixed4096:throughput-minimum-bytes-per-second",
      "observed": 28288945.77885515,
      "operator": ">=",
      "threshold": 1600000,
      "passed": true
    },
    {
      "key": "rust-core:performance:scale-logs-medium-fixed4096:memory-processRss-maximum-bytes",
      "observed": 3936256,
      "operator": "<=",
      "threshold": 10485760,
      "passed": true
    },
    {
      "key": "rust-core:performance:scale-logs-small-whole:initialization-p95-ms",
      "observed": 0.073992,
      "operator": "<=",
      "threshold": 1,
      "passed": true
    },
    {
      "key": "rust-core:performance:scale-logs-small-whole:processing-p95-ms",
      "observed": 1.466108,
      "operator": "<=",
      "threshold": 40,
      "passed": true
    },
    {
      "key": "rust-core:performance:scale-logs-small-whole:throughput-minimum-bytes-per-second",
      "observed": 44712940.65648642,
      "operator": ">=",
      "threshold": 1700000,
      "passed": true
    },
    {
      "key": "rust-core:performance:scale-logs-small-whole:memory-processRss-maximum-bytes",
      "observed": 3452928,
      "operator": "<=",
      "threshold": 10485760,
      "passed": true
    }
  ],
  "failures": []
}
